{
  "meta": {
    "engine": "ZDSM",
    "version": "1.4-P3",
    "report_mode": "professional",
    "prediction_mode": "trend",
    "profile": {
      "profile_id": "main_1997_05_18",
      "gender": "女",
      "solar_datetime": "1997-05-18T16:28:00+08:00",
      "true_solar_datetime": "1997-05-18T16:31:00+08:00",
      "lunar_datetime": "丁丑年四月十二日申时",
      "five_element_bureau": "土五局",
      "ming_master": "文曲",
      "body_master": "天相",
      "body_palace": "官禄宫"
    }
  },
  "annual_causal_chain": {
    "layers": [
      {
        "layer": "大限",
        "palace": "福德宫",
        "source": "chart.age_ranges"
      },
      {
        "layer": "小限",
        "palace": "交友宫",
        "source": "chart.minor_limit_ages"
      },
      {
        "layer": "流年",
        "palace": "子女宫",
        "source": "chart.annual_ages"
      },
      {
        "layer": "流月",
        "palace": "夫妻宫",
        "source": "upstream_locked_convention"
      },
      {
        "layer": "流日",
        "palace": "夫妻宫",
        "source": "upstream_locked_convention"
      },
      {
        "layer": "流时",
        "palace": "田宅宫",
        "source": "upstream_locked_convention"
      }
    ],
    "repeated_nodes": [
      {
        "palace": "夫妻宫",
        "layers": [
          "monthly",
          "daily"
        ]
      }
    ],
    "causal_summary": "按权限从大限到短周期逐层收窄；短周期只允许细化已经存在的结构，不单独创造重大事件。",
    "short_term_gating": [
      {
        "layer": "monthly",
        "palace": "夫妻宫",
        "status": "weak_short_term_signal",
        "reason": "does_not_repeat_upper_layer_node"
      },
      {
        "layer": "daily",
        "palace": "夫妻宫",
        "status": "weak_short_term_signal",
        "reason": "does_not_repeat_upper_layer_node"
      },
      {
        "layer": "hourly",
        "palace": "田宅宫",
        "status": "weak_short_term_signal",
        "reason": "does_not_repeat_upper_layer_node"
      }
    ]
  },
  "conclusion_ownership": [
    {
      "claim_id": "CLM-338521a60a",
      "owner_section": "身体",
      "summary": "行动/生产速度与恢复系统之间的配速，是身体轴的核心问题。"
    },
    {
      "claim_id": "CLM-b37743986c",
      "owner_section": "事业",
      "summary": "职业优势更偏向解决复杂问题、重构旧结构，而不是长期只维护固定流程。"
    },
    {
      "claim_id": "CLM-c92539e730",
      "owner_section": "事业",
      "summary": "长期复利更依赖把项目经验、表达和知识转成可重复使用的资产。"
    },
    {
      "claim_id": "CLM-b358bda963",
      "owner_section": "钱",
      "summary": "钱的核心不是‘有没有能力创造价值’，而是价值如何被定价、成交、回收并留下。"
    },
    {
      "claim_id": "CLM-ba4d28cefa",
      "owner_section": "爱情/关系",
      "summary": "关系质量更依赖规则、协商与兑现，而不是只看情绪浓度。"
    },
    {
      "claim_id": "CLM-4b22b2d922",
      "owner_section": "朋友/社群/同行",
      "summary": "社群与同行更适合作为信息、渠道和引荐入口，而不应直接替代真实性判断。"
    },
    {
      "claim_id": "CLM-f26ea2f1be",
      "owner_section": "兄弟姐妹/同辈/团队",
      "summary": "同辈支持往往和责任、协调或善后绑定。"
    },
    {
      "claim_id": "CLM-29af033a78",
      "owner_section": "父母/亲人/长辈",
      "summary": "长辈、上级和机构可能同时提供资源与评价/规则压力。"
    },
    {
      "claim_id": "CLM-3ea8e46bdc",
      "owner_section": "合作方/客户/上级",
      "summary": "合作能不能做，核心取决于决策权、资源权、付款权和责任是否对称。"
    },
    {
      "claim_id": "CLM-aa06a9fa25",
      "owner_section": "晚辈/学生/下属/粉丝/受众",
      "summary": "表达、作品、教学和受众既可能成为资源入口，也容易形成持续反馈成本。"
    }
  ],
  "sections": {
    "身体": [
      {
        "claim_id": "CLM-338521a60a",
        "family": "BODY-RECOVERY",
        "owner_section": "身体",
        "summary": "行动/生产速度与恢复系统之间的配速，是身体轴的核心问题。",
        "core_tendency": "身体判断优先看“负荷—恢复—再次投入”的循环，而不是把单颗疾厄星直接等同具体疾病。",
        "possible_manifestations": [
          "高压项目、持续输出或连续赶进度后，恢复质量更容易决定下一轮发挥。",
          "如果身体状态下降，现实表现更可能先出现在注意力、耐力、动作质量或恢复速度，而不是命理直接指定某种疾病。"
        ],
        "reality_checks": [
          "记录高强度工作后的恢复时长",
          "比较睡眠充足与不足时的工作/运动表现",
          "观察压力上升时是否同步出现身体负荷信号"
        ],
        "disconfirming_conditions": [
          "长期高强度工作后仍能稳定恢复，且身体状态与压力水平长期无明显关联"
        ],
        "evidence_trace": [
          {
            "layer": "natal",
            "palace": "疾厄宫",
            "detail": "太阴(陷)",
            "evidence_type": "M"
          },
          {
            "layer": "natal",
            "palace": "疾厄宫",
            "detail": "太阴生年/自化禄",
            "evidence_type": "M"
          },
          {
            "layer": "school_specific_self_transform",
            "palace": "疾厄宫",
            "detail": "太阴生年/自化↑科",
            "evidence_type": "S"
          },
          {
            "layer": "natal",
            "palace": "官禄宫",
            "detail": "身宫落官禄：后天能量大量投入生产/角色",
            "evidence_type": "T+M"
          },
          {
            "layer": "natal",
            "palace": "福德宫",
            "detail": "天魁:support",
            "evidence_type": "M"
          },
          {
            "layer": "natal",
            "palace": "福德宫",
            "detail": "火星:amplification",
            "evidence_type": "M"
          }
        ],
        "confidence": "high",
        "action_ids": [
          "A-RECOVERY"
        ],
        "tags": [
          "recovery",
          "body"
        ]
      }
    ],
    "事业": [
      {
        "claim_id": "CLM-b37743986c",
        "family": "CAREER-MODE",
        "owner_section": "事业",
        "summary": "职业优势更偏向解决复杂问题、重构旧结构，而不是长期只维护固定流程。",
        "core_tendency": "职业系统更适合有判断权、重构空间、项目性或复杂问题处理的工作形态。",
        "possible_manifestations": [
          "可能表现为更适合项目型、产品型、咨询型、策略型、内容系统化或0→1任务。",
          "在高度固定、只重复既定流程的岗位中，能力未必差，但主观消耗可能更高。"
        ],
        "reality_checks": [
          "过去最投入的工作是否往往包含‘发现问题—重新设计—推进落地’",
          "是否在拥有自主决策空间时表现明显更好",
          "长期纯维护型任务是否更容易失去动力"
        ],
        "disconfirming_conditions": [
          "长期最稳定、最满意的工作始终是低变化、低自主、重复维护型任务"
        ],
        "evidence_trace": [
          {
            "layer": "natal",
            "palace": "官禄宫",
            "detail": "紫微+破军:统筹与重构结合，适合改造旧结构、项目重组与从0到1。",
            "evidence_type": "T+M"
          },
          {
            "layer": "natal",
            "palace": "官禄宫",
            "detail": "紫微(庙)",
            "evidence_type": "M"
          },
          {
            "layer": "natal",
            "palace": "官禄宫",
            "detail": "破军(旺)",
            "evidence_type": "M"
          },
          {
            "layer": "natal",
            "palace": "官禄宫",
            "detail": "身宫同落官禄",
            "evidence_type": "T+M"
          },
          {
            "layer": "natal",
            "palace": "命宫",
            "detail": "武曲+七杀:执行与高压决断相互放大，行动快、抗压强，同时控制成本和冲突风险上升。",
            "evidence_type": "T+M"
          }
        ],
        "confidence": "high",
        "action_ids": [
          "A-FOCUS"
        ],
        "tags": [
          "career",
          "work_mode"
        ]
      },
      {
        "claim_id": "CLM-c92539e730",
        "family": "CAREER-ASSET",
        "owner_section": "事业",
        "summary": "长期复利更依赖把项目经验、表达和知识转成可重复使用的资产。",
        "core_tendency": "单次完成任务不是终点；把成果沉淀为方法、模板、知识库、作品库或产品组件，才能提高下一轮起点。",
        "possible_manifestations": [
          "同一个问题第二次出现时，如果已有模板或方法，效率会显著高于从零开始。",
          "作品、研究、项目经验越能结构化保存，职业系统越稳定。"
        ],
        "reality_checks": [
          "统计过去一年哪些成果被二次复用",
          "观察是否经常做完即丢、下一次重新从零开始",
          "计算可重复使用资产占成果的比例变化"
        ],
        "disconfirming_conditions": [
          "长期不做任何知识/流程沉淀仍能稳定获得同等复利，并且重复劳动成本不升高"
        ],
        "evidence_trace": [
          {
            "layer": "natal",
            "palace": "田宅宫",
            "detail": "天机(庙)",
            "evidence_type": "M"
          },
          {
            "layer": "natal",
            "palace": "田宅宫",
            "detail": "天机:科",
            "evidence_type": "M"
          },
          {
            "layer": "school_specific_self_transform",
            "palace": "田宅宫",
            "detail": "天机:↑权",
            "evidence_type": "S"
          },
          {
            "layer": "natal",
            "palace": "田宅宫",
            "detail": "文曲:support",
            "evidence_type": "M"
          },
          {
            "layer": "natal",
            "palace": "子女宫",
            "detail": "输出端存在生年忌：输出价值伴随反馈/反复成本",
            "evidence_type": "M"
          }
        ],
        "confidence": "high",
        "action_ids": [
          "A-ASSET"
        ],
        "tags": [
          "asset",
          "knowledge"
        ]
      }
    ],
    "钱": [
      {
        "claim_id": "CLM-b358bda963",
        "family": "MONEY-CAPTURE",
        "owner_section": "钱",
        "summary": "钱的核心不是‘有没有能力创造价值’，而是价值如何被定价、成交、回收并留下。",
        "core_tendency": "财务系统更需要规则化价值捕获：边界、报价、付款、投入上限和现金流管理。",
        "possible_manifestations": [
          "可能出现成果很多，但实际收入、回款速度或最终留存与投入不完全同步。",
          "机会越多时，选择成本和资源分散问题反而更值得关注。"
        ],
        "reality_checks": [
          "比较项目产出价值与实际到账金额",
          "记录从报价到回款的周期",
          "检查是否存在大量低兑现机会占用时间"
        ],
        "disconfirming_conditions": [
          "长期所有成果都能稳定按预期定价、及时回款且现金留存与产出完全同步"
        ],
        "evidence_trace": [
          {
            "layer": "natal",
            "palace": "财帛宫",
            "detail": "廉贞+贪狼:规则边界、欲望与扩张相互放大，创造与社交动力强，也需要更强边界控制。",
            "evidence_type": "T+M"
          },
          {
            "layer": "natal",
            "palace": "财帛宫",
            "detail": "廉贞(陷)",
            "evidence_type": "M"
          },
          {
            "layer": "natal",
            "palace": "财帛宫",
            "detail": "贪狼(陷)",
            "evidence_type": "M"
          },
          {
            "layer": "natal",
            "palace": "财帛宫",
            "detail": "陀罗:disruption",
            "evidence_type": "M"
          }
        ],
        "confidence": "high",
        "action_ids": [
          "A-CONTRACT",
          "A-CASHFLOW"
        ],
        "tags": [
          "money",
          "value_capture"
        ]
      }
    ],
    "爱情/关系": [
      {
        "claim_id": "CLM-ba4d28cefa",
        "family": "LOVE-PARTNER",
        "owner_section": "爱情/关系",
        "summary": "关系质量更依赖规则、协商与兑现，而不是只看情绪浓度。",